{
  "schemaVersion": "0.2.0",
  "rootPath": "/repo",
  "projectCount": 1,
  "fileCount": 1,
  "typeCount": 1,
  "memberCount": 1,
  "metricResultCount": 1,
  "diagnosticCount": 1,
  "analysisHealth": {
    "analysisQuality": "trusted",
    "semanticModel": "msbuild",
    "restoreStatus": "success",
    "buildStatus": "not_run",
    "trustedDiagnostics": true,
    "diagnosticsIncludedInHotspotRank": true,
    "messages": [
      "dotnet restore succeeded for SimpleProject.csproj."
    ]
  },
  "hotspots": [
    {
      "targetId": "member:SimpleProject/M:SimpleProject.Calculator.Add(System.Int32,System.Int32)",
      "targetKind": "member",
      "targetName": "Calculator.Add",
      "rank": 1,
      "rankScore": 0.85,
      "filePath": "tests/CodeMetricsToolkit.TestAssets/SimpleProject/Calculator.cs",
      "startLine": 5,
      "endLine": 8,
      "reasons": [
        "cyclomatic_complexity p95"
      ],
      "components": [
        {
          "metricId": "cyclomatic_complexity",
          "value": 3,
          "percentile": 0.95,
          "weight": 0.25
        }
      ]
    }
  ]
}
